assessment_id,pronunciation_avg,vocab_avg,fluency_avg,cohesion_avg,grammar_avg,cefr_avg,suffix,transcript,filler_word_count,formants_mean,formants_median,formants_std,formants_min,formants_max,mfccs_mean,mfccs_std,mfccs_var,spectral_centroid_mean,spectral_bandwidth_mean,pitch,intensity,speech_rate,intensity_to_speech_rate_ratio,pauses_duration,pauses_frequency,brunets_index,average_sentence_length,cohesion_score,flesch_kincaid_score,coleman_liau_index,automated_readability_index,repetitions
1691402791754105-1,4.0,4.0,3.5,3.0,4.0,4.0,0,"My advice to a worker in my office is if you don't understand something, do ask. Don't start working on doing something without asking or understanding what you're doing.",2,1784.8401420481173,1602.794458755096,1176.4173462207154,0.0,5022.638122380002,-20.793592,38.09893,38287428.0,2215.14585583706,1647.2691434075473,1592.4277,0.047636498,0.14724186074144488,0.32352550779990935,0.0123125,0.3745247148288973,1.7008268430839244,17.5,0.6360155940055847,8.092142857142857,6.364571428571427,13.430344827586204,0
1691402791754105-2,4.0,4.0,3.5,3.0,4.0,4.0,1,"I would love to communicate with dolphins. I don't know why, I just like them. And I would ask them what they think about us humans and what is the most exotic place you've been.",2,1746.9750371308028,1618.3327496673264,1158.493540324331,0.0,4943.353091302711,-19.272009,38.28016,40041920.0,2380.7063084017036,1731.1432047636229,1521.9271,0.06274363,0.17184647497852235,0.3651144228753055,0.0116875,0.32130584192439865,1.722562629490293,13.666666666666666,0.6350653171539307,3.842439024390245,2.685853658536587,8.357047619047616,0
1691402791754105-3,4.0,4.0,3.5,3.0,4.0,4.0,2,"That's a good question. I do not have... I don't know what to say about it, I'm sorry. They are both... health and privacy are important.",1,1741.4127758887,1406.9638699316718,1314.6601860130652,0.0,5891.098909113541,-23.344748,45.678455,80268040.0,2147.685152778692,1595.313905840381,1815.5391,0.043487795,0.11899512705176768,0.3654586181362347,0.0191875,0.5168350168350169,1.7329302194658671,8.75,0.6598869562149048,1.9825000000000017,-0.3668571428571443,4.832521367521366,0
1691402791754105-4,4.0,4.0,3.5,3.0,4.0,4.0,3,"Okay then, if I have an ideal project, I would first try to get some funding from my family and turn to banks or some rich people that I know. And I will try to write some grants and ask some help with fundings. First I will build a team that will think with me how to proceed with the idea and try to purchase things or machines that will help me proceed and create my thoughts and dreams. That's it.",4,1668.097705610354,1369.2818918586572,1510.3235376782848,0.0,6213.3575728876785,-26.53711,40.100395,47620824.0,1829.7684967544888,1374.573103088654,1727.8802,0.031611174,0.11587407088350232,0.27280628102552623,0.0705625,0.47697507393324884,1.7715350382047212,22.0,0.571516215801239,6.53318181818182,4.3031818181818196,12.012407407407402,0
1691402791754105-5,4.0,4.0,3.5,3.0,4.0,4.0,4,"In my city, the system is that everyone should put, if he likes to, should put the plastics and packages in different bins, and this material are collected and dumped somewhere. The drawbacks is that it depends on the people, if they are willing to do this, and if they are not separating their garbage, it is not done. What might encourage people to recycle more? Maybe telling them that their dumped will not be collected if they will not recycle.",4,1827.2157936944934,1462.0442085580487,1604.4587675635405,0.0,6600.259172484308,-25.093914,39.83878,46743132.0,2071.6953319724926,1444.3133427449793,1690.9877,0.044770613,0.13827972412109374,0.32376845989014935,0.062625,0.4473214285714286,1.7527703054973112,23.0,0.5716919302940369,9.284347826086957,6.496956521739129,14.803518518518523,0
1691402791754106-1,3.5,3.5,4.0,3.5,3.5,3.5,0,"I prefer to live in the country because I think the advantages of the country is that it's a quiet place, it's close to nature. You live a more subtle life, more relaxed life.",0,1554.5674315961405,1591.684850592916,616.1815931371867,433.85821859812523,3452.9764786365363,-9.040367,23.427336,6729645.0,1973.0643539022178,1854.1804758347143,1503.1804,0.07569372,0.11553419682017543,0.6551628969805849,0.0185625,0.47368421052631576,1.7429931071630576,20.0,0.5964133143424988,6.960000000000001,3.5939999999999976,11.312647058823536,0
1691402791754106-2,3.5,3.5,4.0,3.5,3.5,3.5,1,"I would like to talk about my son, Itay. He's the youngest of my three kids. I think I like it. It's important to me because we are the same in a lot of aspects. We behave the same, we have the same humor. He's a very smiley kid, likes to smile. He's thin and long, he's high for his age, he's six years old. And we have a lot of games that me and him play all the time in the pool. We invented a new game called Kadu Karish, we like to play it in the summer in the pool. He likes to do a lot of things, he likes Pokemon, he likes playing the Nintendo Switch, the Playstation 2. He likes to build houses in the living room from pillows. Now he's going to go to the first grade, he's going to be a first grader with his brother that is older than him in four years.",11,1494.8358185082384,1511.716538896556,682.9379893350807,307.72552382987857,4091.9209151135765,-10.42309,24.671373,8330778.0,1972.9668476304205,1912.5662301048926,1278.5745,0.07162321,0.1016577932863943,0.7045521181776171,0.070125,0.44506148353827846,1.8063001276853345,15.833333333333334,0.5529587268829346,4.558684210526316,1.0536842105263169,7.726916666666671,0
1691402791754106-3,3.5,3.5,4.0,3.5,3.5,3.5,2,"We just came from a trip, a family trip to the mountains of Czech Republic. It's called Spingelrov Melin. It's a place that in the winter you can ski, and in the summer you can do hiking in the mountains, you can do water sports in the river, you can do bike trips. We went there as a family, we took a hotel, a very nice hotel. We saw a lot of mountains, a lot of rivers and falls of water. We went to museums, we went to parks for the kids, amusement parks for the kids. We saw a lot of German people there. We did, what did we do? We went to the pool, we went for hiking, we did alpinistic rides. Yeah, it was a nice vacation, the kids loved it. Because they had a lot of attraction, on a trip you get what you want. It's a more relaxed situation, between the kids, between the family, everybody's having fun. And I think we're going to do it again. We enjoyed very much Prague and Spingelrov Melin, it's the place we stayed for a week, it was very nice.",2,1393.419862927083,1290.7877243017404,693.2410463341062,317.75315582380625,3412.881253588367,-10.377564,22.541727,5515770.0,1875.7828808038325,1811.1555932505144,1328.5515,0.069679864,0.10227199064470627,0.6813191306014862,0.0790625,0.4198473282442748,1.8454799718536905,16.571428571428573,0.5635409951210022,5.6737192118226645,1.8279310344827593,8.903549107142858,0
1691402791754106-4,3.5,3.5,4.0,3.5,3.5,3.5,3,"I think my best teacher was the VP of Engineering, Moshe Tchetchik. He was very good at his job. He was a very good engineer, very good VP. I learned from him to go to a problem and be very analytical about the steps I need to do to get to the cause reason, the cause of the function or problem that I have in the instruments. He taught me how to write a deviation report to do a report about the reasons that cause the problem. He taught me how to both live my life and have the right ratio between work and home. He taught me how to ride the bicycles, mountain bikes. I learned a lot from him on how to do mountain biking.",3,1419.7754343161414,1415.2161562061901,637.5527015713827,319.403388573285,3482.3002330808777,-12.127877,23.67566,7076931.5,1805.5658264461983,1890.6666515530844,1244.6161,0.051286373,0.07270204864279198,0.7054322986058539,0.084125,0.4912408759124088,1.7805525680911245,17.375,0.5456625819206238,6.297041366906477,3.5628776978417207,9.649547244094489,0
1691402791754106-5,3.5,3.5,4.0,3.5,3.5,3.5,4,"I really want to go back to Sinai to the Hushot on the water to have a vacation in Sinai. It's something different because you have the most feeling of freedom. The cellular is not working, you're on the beach somewhere, a deserted place. You have the sand, you have the ocean with coral reefs. You are like living the life in slow motion. Nothing happened, everything is relaxed. People are talking, joking. If you want to have company you can. If you want to be quiet and talk to nobody, you can do that as well. I want to do it because it's good for me, it's relaxed. I can come back to work more relaxed. It's the perfect vacation to do it. I think I will do it, me and my wife. I will take my wife to Sinai, to Rasa Satan, sit on the beach in the bay when the sun goes down. You see the sunset, drink some mojitos and enjoy life, relax. There's nothing to do. You don't need to take care of nobody. You don't need to care about nothing and just enjoy your time in Sinai.",4,1548.1653641579915,1535.7795035580075,753.3239786616231,280.2450508369949,3304.350189874782,-12.02176,24.700903,7657687.5,1985.1793999353947,1857.810118174652,1443.3689,0.059967954,0.10158920681759546,0.5902984735319495,0.0840625,0.4626762985896113,1.814484591177755,12.833333333333334,0.5763095021247864,4.382099567099569,1.8244155844155827,7.725152561888315,0
1691402791754115-1,3.5,3.5,3.5,3.0,3.0,3.5,0,I use my cell phone a lot. I use it for emails and Facebook and Instagram and I want to be in contact with my friends. I have all my calendar in my cell phone. I have the birthdays of my children and I have notes and I make a list of the things that I have to do or not to do and before I'm going shopping I have also the list of the things that I have to buy. I have a lot of photos so I have after each trip I make an album of the photos that I do during my trip.,3,1066.4571894891665,854.1626933768773,860.1679145298441,0.0,5297.153422467703,-26.405455,29.043081,11715457.0,1224.6286772598455,1194.3715209075526,1179.5507,0.039782774,0.06467439977134147,0.6151239724526252,0.0578125,0.45121951219512196,1.722562629490293,22.4,0.5778834223747253,6.947785714285715,1.778571428571425,9.831792452830186,0
1691402791754115-2,3.5,3.5,3.5,3.0,3.0,3.5,1,"I am working in a drug company where they are a technological drug producer. So we help people with our new drugs that help them to pass the illness. So more drugs we produce, they help the big community of the people that have febreeze or other diseases.",2,1404.9318111892808,1006.5815836991837,1083.2018737992585,0.0,6271.929114926729,-23.553709,27.286205,8930586.0,1494.6582120888263,1385.5713369939522,1397.3218,0.041817386,0.06908353117258464,0.6053162742775405,0.0323125,0.4269199009083402,1.7329302194658671,17.333333333333332,0.5765994787216187,7.054615384615385,6.01230769230769,11.591875000000002,0
1691402791754115-3,3.5,3.5,3.5,3.0,3.0,3.5,2,I was in trouble with a friend of mine. I really don't understand what happened between us. She was angry about me and she didn't say anything to me. So she shared her thoughts with other people and I heard that she disagreed with some of my ideas and I really feel bad about this because she never talked to me and she never decided to share with me her thoughts and never said to me that she disagreed with me. So the result is that we are not in touch with each other anymore.,3,1344.6042000285101,1024.1660785046333,983.6339904438506,0.0,5733.141620086203,-23.997507,31.277008,16728214.0,1653.8051379614224,1439.256133685891,1529.8125,0.040833727,0.09127786276223776,0.44735629526812143,0.0495625,0.3961038961038961,1.722562629490293,20.4,0.6139940023422241,7.636588235294116,4.943137254901959,11.818315789473687,0
1691402791754115-4,3.5,3.5,3.5,3.0,3.0,3.5,3,"My best teacher, it was my English teacher. She is so kind and patient to me and I learn a lot of about English and life and everything that I know it's from her and I miss her so much.",2,1716.9597667168364,1465.1748209141751,1242.5219426245212,0.0,5629.40628516467,-25.995344,33.73364,21548972.0,1821.8222971444043,1462.8107118037324,1719.2136,0.038360965,0.09226984797297297,0.4157475637989668,0.029,0.5016216216216216,1.7527703054973112,22.0,0.620090126991272,7.203636363636367,2.365454545454547,10.353750000000002,0
1691402791754115-5,3.5,3.5,3.5,3.0,3.0,3.5,4,"I want to be in the future a guide. I want to guide people maybe in Albania, the country they are coming from, because something that I like to do it, I do it in the past and maybe I can do it in the future. So for the beginning I have to learn about this, maybe to take some course and some classes and to learn more about how to be a tourist guide and after that to begin with this, maybe to begin with my friends and after that maybe I can take some tourists and do it.",6,1824.391756918528,1229.5097228348782,1228.7873694146288,0.0,4602.509588284619,-22.865175,30.941813,15170597.0,1964.5999002666,1713.9761246220514,1791.9435,0.05478643,0.062448395492119904,0.8773072290717097,0.046625,0.4610630407911001,1.7329302194658671,36.0,0.6488238573074341,12.435185185185187,3.6855555555555526,17.467866666666666,0
1691402791754118-1,3.5,3.0,3.0,3.0,3.0,3.0,0,I'm using it to follow other people that are interesting to me. I like it because it's a fun and a lot of time I see things that I didn't know that exist.,1,467.1891951062078,467.5899089258695,582.138654710403,0.0,7860.132854720414,-30.207867,23.126522,4320209.5,507.0808831599292,718.7507697336564,738.3819,0.04313537,0.021964213346541788,1.9638932830695193,0.0463125,0.5338616714697406,1.7008268430839244,19.0,0.6662816405296326,6.104210526315793,1.5199999999999996,8.8,0
1691402791754118-2,3.5,3.0,3.0,3.0,3.0,3.0,1,"This is a very hard question. Sorry. But I tried to think about something surprising, but nothing came up.",2,483.40555857856566,0.0,824.9494427799453,0.0,5240.230350388171,-32.872944,28.170778,9697182.0,482.3741946963716,546.4129493137449,914.98956,0.04407327,0.0198203125,2.2236414673669533,0.0291875,0.6226666666666667,1.722562629490293,7.666666666666667,0.6590740084648132,3.817391304347826,2.8365217391304327,8.013508771929825,0
1691402791754118-3,3.5,3.0,3.0,3.0,3.0,3.0,2,"There are a lot of things that we can do in order to protect the environment. I don't think this is an important thing, but those are things that I believe that everyone can do in his own house, like recycling the garbage or use the not one-time dishes.",1,722.5483802068123,652.4555204376634,675.215063874769,0.0,5659.209608037372,-31.161217,27.63455,10188503.0,732.9478740438263,950.5012195613388,714.6388,0.03842899,0.03003802917753353,1.279344529582414,0.0389375,0.4642324888226528,1.7429931071630576,27.0,0.6050469279289246,10.236296296296299,5.425925925925924,15.138979591836737,0
1691402791754118-4,3.5,3.0,3.0,3.0,3.0,3.0,3,Our government decided to change our democracy. I think this is a negative change because it can ruin our democracy.,0,595.2728018521555,547.4898478673459,643.9609640595796,0.0,4627.569274368807,-29.215816,31.516722,17115304.0,652.0896598444568,830.7219237700206,634.8662,0.06279997,0.03090658532567771,2.0319283791353513,0.0185,0.4457831325301205,1.6653278397556168,11.0,0.6032953858375549,7.472727272727273,7.434545454545454,10.887999999999998,0
1691402791754118-5,3.5,3.0,3.0,3.0,3.0,3.0,4,"I don't think it should be required to wear school uniforms because I don't think it's I don't think we should, we will not teach them something else.",1,465.4539326323089,0.0,727.8097601524219,0.0,4209.1909446707805,-32.48776,25.481283,6459874.0,451.88892517381896,588.3433344755535,826.4287,0.039440017,0.01795892878320683,2.196123035491721,0.042,0.6375711574952562,1.7008268430839244,34.0,0.6862069368362427,11.899411764705885,4.601176470588232,17.802142857142854,0
1691402791754221-1,2.5,3.0,2.5,2.5,2.5,2.5,0,"I am working in the production in my job, I am team leader in production, it's a very hard worker and very interested.",0,1131.8132179665631,1086.7493353547104,324.29750812992677,458.2308732179983,2563.2731865911182,-10.338043,19.829266,3855135.5,1500.560880577907,1735.380023927327,1019.0569,0.051802237,0.07112646010315533,0.7283117494063379,0.0338125,0.525242718446602,1.722562629490293,27.0,0.5602090358734131,11.984444444444446,4.010370370370371,14.234347826086953,0
1691402791754221-2,2.5,3.0,2.5,2.5,2.5,2.5,1,I am going to talk to the teacher of the English learning. I was learning from him a very good sentence and a very good... He was learning me a new vocabulary and a new sentence. He was a very good teacher because he taught us well.,0,1311.3622546260906,1312.7038839671313,431.57081909752014,386.85562968125043,3698.7854927979383,-12.271357,20.162361,3881341.5,1639.4864517376097,1871.6611899882957,990.6724,0.040334944,0.06764321731661813,0.5962895510004981,0.1025625,0.5973789588642155,1.7118692955940733,12.75,0.5815446972846985,4.8844607843137275,3.323137254901958,5.736028368794326,0
1691402791754221-3,2.5,3.0,2.5,2.5,2.5,2.5,2,"I like to go to the engineering in my workplace. I like this work. It's very important work, very kind of work for the engineering. Are there others who might disagree with you? Yes, others can work in the production all the time. But I want to go to the new kind of work. I want to go to the engineering work. How will you answer the question? I want to go to new work, to go to new exciting work.",2,1114.7738068464155,1133.662561395834,425.4661128482244,364.4567007739887,3132.558127670464,-11.075776,18.080738,2623565.0,1486.4142437239293,1717.4262667865953,915.24817,0.05467826,0.07132690190802349,0.7665867970904974,0.079,0.49471624266144815,1.7805525680911245,10.444444444444445,0.6467292308807373,3.1705673758865274,1.257872340425532,6.212962962962962,0
1691402791754221-4,2.5,3.0,2.5,2.5,2.5,2.5,3,"No, I just stay just me. I like what I do, I like what I'm doing all the time. I'm doing very much study of engineering, of technology. I don't want to become someone else, I like to be just me.",4,1199.0297223487019,1198.8936060722485,442.4571900382594,419.1308018284552,2802.8011424613765,-10.688932,19.442291,3445465.2,1582.0141731974065,1782.6960149849642,908.7646,0.056879617,0.07716598510742187,0.7371073821532386,0.0395,0.49375,1.7329302194658671,13.0,0.6813276410102844,3.549230769230771,-0.6630769230769218,5.981341463414633,0
1691402791754221-5,2.5,3.0,2.5,2.5,2.5,2.5,4,"No, I don't want to move to a new city or to a town because I was born in a village in Julis. I like Julis village. People here are very good. We are same Druze. It's very difficult to move to a new city or a new town because you have to change maybe what you do every day or else. I think about to leave a new country, maybe.",1,1233.972769062356,1198.2912626000584,486.31245042532976,386.1655474485133,3063.7161824983677,-11.985784,17.475466,2329807.8,1623.4393375723862,1769.4911942654373,1069.6097,0.05241263,0.08004322996426748,0.6548040246614266,0.05425,0.44308320571720267,1.7805525680911245,13.5,0.5730066895484924,3.805864197530866,0.5911111111111076,6.112863849765262,0
1691402791754235-1,3.5,4.5,3.0,3.5,3.5,3.5,0,"My favorite place is the sea. I like about the sea, what I like about the sea is it's quiet and I like the sand and the sun. I like to swim in the sea and enjoy the warmth of the sun.",4,1175.9042487432766,1133.1918876976738,1296.8447628607084,0.0,7910.127972602295,-32.33501,43.817734,70153940.0,1353.4938148954807,916.9870138930245,1587.2965,0.02804275,0.09338275853798926,0.30029901527999103,0.0479375,0.5886415963161934,1.7429931071630576,15.666666666666666,0.5768329501152039,3.5753191489361704,0.07574468085106467,6.092142857142857,0
1691402791754235-2,3.5,4.5,3.0,3.5,3.5,3.5,1,"An object that I'm using a lot is Pipetto. It's a device that allows me to add or remove an exact volume, small volumes of liquid. I'm using it by pressing a button that sucks the liquid and releases it. I'm using it for developing essays, for quantitative essays, for proteins and that's it.",2,1547.7555984589765,1462.2927737789491,1285.00715631611,0.0,7229.07774240031,-32.575886,45.66165,84713850.0,1659.7080561817995,1165.6772833383372,1550.5752,0.023750128,0.11103925122493163,0.21388948468664978,0.0655625,0.4781221513217867,1.7715350382047212,16.5,0.5005072951316833,7.651060606060607,3.698787878787879,10.788888888888884,0
1691402791754235-3,3.5,4.5,3.0,3.5,3.5,3.5,2,A nice memory for me is when my first daughter was born. What makes the memory good is that after my first born I had three more children and I remember how it was to be a dad for the first time and after four kids I'm starting to wonder.,0,1333.1793430292598,1310.3027039367357,1190.0979374826725,0.0,6882.794426783309,-33.479355,52.07933,138566290.0,1545.424865638341,1083.192725076294,1565.7981,0.02600366,0.11517324608774962,0.22577865535150454,0.0386875,0.4754224270353303,1.7118692955940733,26.5,0.5947710275650024,9.439339622641508,4.051320754716976,13.489600000000003,0
1691402791754235-4,3.5,4.5,3.0,3.5,3.5,3.5,3,One time I got in trouble for parking space. Someone parked in my private parking space. I confronted him and it started to get ugly. It involved the cops and in the end he got a ticket and I got my parking space back.,1,1436.9730016699357,1676.3270323237257,1260.976667363409,0.0,5690.761348648806,-34.281033,51.592888,132775510.0,1545.4229634646401,1037.2010404941998,1680.6069,0.02202952,0.09920335852581522,0.22206424669970307,0.0484375,0.5264945652173914,1.7118692955940733,12.0,0.552889883518219,4.085833333333333,3.1708333333333343,7.405909090909088,0
1691402791754235-5,3.5,4.5,3.0,3.5,3.5,3.5,4,"Well, next summer I'm going on vacation. I'm going to relax because this year was very intense for me. Probably overseas. I really need it. Definitely it's something that I'm going to do next summer.",3,1080.723656919424,1205.261132586415,1101.498410438335,0.0,7470.697583035327,-32.04794,43.00192,65759664.0,1249.229317202414,868.3851900916504,1640.1019,0.024519099,0.09413202735672757,0.2604756278082851,0.0415,0.5514950166112956,1.7429931071630576,9.0,0.6431914567947388,4.702222222222225,2.47111111111111,8.849714285714288,0
1691402791754257-1,4.0,4.5,4.0,3.0,3.0,4.0,0,"Okay, my favorite book is the biography of a Van Gogh artist. This is a biography about the life of Vincent Van Gogh. The life, the story talk about his entire life from since he was a teenage until he was really older. The story tell all about his adventures and things that happened in his life and how his brother supported him for making art. I really like the story because I feel like his brother was very helpful for him and it makes me very enthusiastic and I really admire his brother.",2,2141.0845778581943,2020.4097592032256,1318.462166611532,0.0,7402.44244512237,-28.188663,38.61433,44396508.0,2387.8625965333326,1523.6426948610756,1682.3779,0.03840472,0.1635629324437348,0.2348008879085205,0.0645,0.41849148418491483,1.7527703054973112,20.2,0.5413762927055359,8.994930693069307,6.079999999999998,12.72255319148936,0
1691402791754257-2,4.0,4.5,4.0,3.0,3.0,4.0,1,"Okay, so my best teacher is Dr. Ronen Mendelkern. He is my teacher in my second, my MC degree in political science. He is a doctor in political science. He is really supportive, encouraged me to going with him all the process of writing a thesis, collecting data, analyzing the data, writing the thesis. He is really supportive, really helpful. Every time I need him, he is available for me. He teach me about new softwares that can help me to write my thesis in a good way. And I really enjoy the work with him.",2,1958.8371892804262,1784.588204222012,1204.4935834476687,0.0,5761.876381519103,-27.138851,31.810034,21084064.0,2292.426175205642,1604.0312779537373,1501.7466,0.042584267,0.14786315046467258,0.28799783028943554,0.051,0.4017725258493353,1.8063001276853345,14.0,0.5239536166191101,6.621785714285718,3.9782142857142837,9.02333333333333,0
1691402791754257-3,4.0,4.5,4.0,3.0,3.0,4.0,2,"The most important things that we can do to protect the environment are to give financial support for projects that are ongoing for environmental improvements such as the cleaning of the sea, such as renewable energy, such as handling all the plastic that we have in the world. We really need to give financial support for these projects since the lack of money is the most important thing for them to upgrade their opportunities, for collaboration, to invest in important things. This action is more important than others since the money is a big part of our world and we see in the past that if we spend money on things that happened, so this is again a thing that we must spend money for it to happen in the future.",1,2229.163658576694,1938.8511683888935,1277.523785042038,0.0,6102.772889225088,-25.839088,29.005066,13024975.0,2586.1486182485005,1666.9079820881225,1594.1322,0.049852602,0.18429003154708012,0.2705116590697587,0.0430625,0.3119058397464916,1.7329302194658671,46.333333333333336,0.6138175129890442,19.11884892086331,8.434820143884892,26.218447837150123,0
1691402791754257-4,4.0,4.5,4.0,3.0,3.0,4.0,3,"20 years from now I think that AI will take a big part in our future. I think that artificial intelligence is a very important skill and it's a very important tool for the world. In 20 years from now we see it everywhere. It will replace a lot of workers, it will improve our life, we can use it for medical, for computers and we can do anything that takes us a lot of time to analyze data. I think about the workers, I think that new works will be available in the future after the AI will enter more to our life.",0,2057.941177048596,1865.653438710991,1242.4149457026128,0.0,7596.394305832044,-27.172668,31.880737,20165714.0,2275.3235473387704,1562.1030205082152,1632.8998,0.0418713,0.14625465618407174,0.28629038501937976,0.057125,0.3856540084388186,1.7622790545754494,22.8,0.6039049029350281,8.828315789473688,4.1007017543859625,12.248269230769232,0
