assessment_id,pronunciation_avg,vocab_avg,fluency_avg,cohesion_avg,grammar_avg,cefr_avg,suffix,transcript,filler_word_count,formants_mean,formants_median,formants_std,formants_min,formants_max,mfccs_mean,mfccs_std,mfccs_var,spectral_centroid_mean,spectral_bandwidth_mean,pitch,intensity,speech_rate,intensity_to_speech_rate_ratio,pauses_duration,pauses_frequency,brunets_index,average_sentence_length,cohesion_score,flesch_kincaid_score,coleman_liau_index,automated_readability_index,repetitions
1692746758560944-2,2.5,3.0,3.0,2.5,2.5,2.5,1,"In our point of view, when we are at work, we also meet many different kinds of people. Sometimes we meet a person that always have a bad mood and a good mood. So, we should have a kind of wisdom and always have a good communication with each other. And a kind of person that we prefer not to work with, when they always have a bad mood. And we didn't do anything but they always have a bad mood. So, I think we should then work with them. And to have a good work, we should have a good mood and always have a good communication with our colleagues. That's it.",6,1521.761291605258,1499.3972388419756,521.9437152703027,465.29424766621696,4012.8362568178063,-10.914495,17.307766,1586794.0,2283.0035014512114,2041.3203855455329,1096.4556,0.03926108,0.12562341228332338,0.3125299624571793,0.034625,0.3311416616855947,1.7527703054973112,16.125,0.6425973176956177,5.1514631782945735,2.784806201550385,8.974092920353982,0
1692746758560944-3,2.5,3.0,3.0,2.5,2.5,2.5,2,"If they ask me which form of communication I'm becoming absolutely, what is happen? So I say it will be not normal for everyone and if I had an opportunity to share one form, I would choose a good form and we should learn it.",2,1659.3859302854707,1583.4563473853186,587.7858919578613,656.3625970278686,4462.671414490139,-9.860256,18.126364,1758474.2,2369.5079942549687,2024.4903573646618,1310.9355,0.040368475,0.14270119180484694,0.2828881420635805,0.0255,0.4163265306122449,1.7429931071630576,25.0,0.6304506063461304,10.208000000000002,4.301599999999997,13.369999999999997,0
1692746758560944-4,2.5,3.0,3.0,2.5,2.5,2.5,3,"Doing an assignment is the best way for the students and always helpful for the students. And for the advantages like when the students go back home, some students always use the phones and they don't read a book. Yes, so if we have homework, people or students will do the homework. And for disadvantages, I think not too much disadvantages. I think it always has advantages for the homework because students will improve their studying. And I think teachers should decide how much homework is appropriate. And yes, as I said, homework is very useful for the students because it helps them to improve their studying.",3,1815.982202701974,1722.2399505350127,665.0271971292034,496.8791859480479,4733.465457529803,-8.425704,17.19048,1439852.5,2741.570182910169,2066.3780724775497,1286.022,0.047465287,0.18875127353216964,0.2514700232783478,0.03375,0.31159838430467396,1.7527703054973112,17.285714285714285,0.5761987566947937,7.924982290436837,7.319669421487603,13.37238985313752,0
1692746758560944-5,2.5,3.0,3.0,2.5,2.5,2.5,4,"For about the children's crime threat in my country, I cannot know something about too much. Yes, I didn't know too much about them. And for about the agreements, the method for the treatment, I think yes, I do. And yes, I agree with it. And for others, oh sorry, I didn't know too much about them. Yes, I cannot answer this.",2,1878.6168765423095,1891.621783242826,475.7845847616077,773.6919916706206,3632.5677645117353,-12.828658,15.4224615,981221.6,2606.5581606559817,2187.9574872529292,1125.2861,0.023517596,0.13422652714932126,0.17520825505602006,0.026625,0.38552036199095024,1.7329302194658671,13.666666666666666,0.6452538967132568,3.842439024390245,0.9648780487804913,8.426182795698928,0
1692747394818154-1,2.0,2.5,2.5,2.0,2.5,2.5,0,"The first person that I love and really like with them, I think that is Talosbee. Because they provide a special for her. He is seeing, he is good and he has a lot of faith. And I like her because she has a beautiful face and a beautiful sound. She is very famous for singing and dancing. Because the song that she writes and the meaning is good for the listener. The meaning is very clear. One more thing, she is a famous one.",5,961.1650538153054,971.8265621223914,336.78520462865254,343.7390130468677,2482.7688554975393,-5.761408,11.217066,285398.47,1423.5801698007456,1594.5021933664782,784.5771,0.07056558,0.08084897536198038,0.8728073671407357,0.0603125,0.4507239607659972,1.7715350382047212,12.0,0.6323966979980469,3.7170833333333313,2.74208333333333,7.543323529411765,0
1692747394818154-2,2.0,2.5,2.5,2.0,2.5,2.5,1,"The thing that is very difficult about me when I'm working, I think is when to deal with the customers. For example, I study at a bank, so I need to deal with the customers to solve the problem. I think that sometimes the customers come and they feel aggressive or they don't feel good with the service. So they just walk out and say something that works for them. But I think that for me that is okay because this is for work, we're going to have a lot of customers, it's not the same. For me, I think that I can make it easier when they feel aggressive. Just tell them about the reason why today the service is not good or anything is not good. You can tell them and they will solve the problem for them.",7,895.5187012704969,844.2569167529914,320.05014232728143,381.1105938206505,2374.806185201621,-4.0271893,9.767348,192894.61,1389.904681336646,1577.4933992581648,896.7705,0.08070207,0.08208080435258093,0.9832026751937064,0.047125,0.32983377077865267,1.7979235760094388,19.75,0.6606014966964722,6.60110759493671,3.8022784810126566,11.07185714285714,0
1692747394818154-3,2.0,2.5,2.5,2.0,2.5,2.5,2,"I think that I think for my area or area of my local to change. For me, I think that we have a trust in the road and I need to have a track or the car who take the trust with us. Because we have a lot in the road. One more thing for me, the thing that I want to have some change, we have a path for the people who can go through without stress. For more, can people go to this path? We have a flower or something to make people feel better after walking the distance. For me, I think that is a good change in my area.",2,970.1069987457655,963.349076324894,317.12089578407824,410.8954905359186,1989.9236495146865,-5.6301475,9.173706,155727.28,1339.534930124468,1591.491807478666,832.53503,0.064521596,0.07053852732419208,0.9147000693556758,0.0551875,0.40191169776968594,1.7622790545754494,17.857142857142858,0.6340696215629578,4.401485714285716,1.5935999999999986,8.190720606826801,0
1692747394818154-4,2.0,2.5,2.5,2.0,2.5,2.5,3,"The education they give to my country is free for the education. For me, I think that the private school and public school, I think that is good also. For me, I prefer the private school because sometimes they have good policies, good than the public school. One more thing, they have a lot of programs for the students. They have some projects, good projects for the students to do. The school that I want to study is ISPP, but I think that is expensive. But it's okay for the country, free for the education because there we have a good environment and we have a good teacher. For me, I think that the environment is the best because it can make the student feel good to study here.",3,912.3908392964167,930.1006920489297,261.6928225884946,383.97354999195164,1821.3464235634121,-2.8813207,9.541121,183242.53,1358.2441300542469,1560.2961690441982,744.9998,0.0890578,0.07364323282292032,1.2093141452404277,0.0706875,0.396981396981397,1.7979235760094388,18.375,0.6380696892738342,6.82795068027211,4.829115646258501,11.60645348837209,0
1692747394818154-5,2.0,2.5,2.5,2.0,2.5,2.5,4,"I would like to talk about the reading. For me, sometimes I... Actually, the reading is good for the people and also for me, but sometimes I don't have time to take the book or take the carrier, the book, on the bed or anything. So I just read in the phone, because in the phone we have the Google to research something that we want to read. Sometimes when I get the book, I get it in the library at my university or school to get some books like history, like history about English books. Sometimes we have like novels books or anything. For me, in my country, I think that half of the people enjoy reading the book too. Because nowadays when I stay in the bus station, I see a lot of people carry the book without using the phone.",13,1093.1428873262712,1018.2658617969906,439.0818359399634,404.85696903817643,2626.704301820121,-9.924732,12.761355,495414.0,1573.6307763642205,1709.4096555156932,984.4006,0.044983048,0.08050707218506131,0.558746539541131,0.0588125,0.34968413229282796,1.7893447413724344,23.285714285714285,0.6073027849197388,8.911060473269064,4.212269938650305,9.829930069930072,0
1692747394818610-1,2.5,2.5,2.5,2.0,2.5,2.5,0,"Well, I like watching soccer twice a week because in the free time I always watch soccer like Miami vs Real Madrid or something like that. I usually watch soccer twice a week and...",7,1860.4411374105316,1856.9216216910772,703.9620899436944,486.74876097354326,3737.413324164095,-14.6198015,30.029167,14667991.0,2194.494504936183,1866.4516224578808,1649.121,0.030690592,0.10386001078914919,0.2954996013300807,0.0190625,0.376078914919852,1.7329302194658671,18.5,0.5472218990325928,7.2520270270270295,6.119999999999997,7.893823529411762,0
1692747394818610-2,2.5,2.5,2.5,2.0,2.5,2.5,1,"Ok, now day I'm working and also studying. And describe my job or study. My job, I work as a teaching, learning and resource. And for my university, I study as a information technology. What do I like most about what I do? Well, I think is I can communication with foreigner teacher. Yes, like literature or foreign come to visit Asia, you know. So I can communicate with them and support them when they have a problem.",6,1756.3728592704288,1683.0841080921996,726.9264420436799,0.0,6809.608951279851,-13.954198,33.908188,25379086.0,2008.956394611109,1744.4263859614182,1596.5045,0.03635106,0.10568688048577482,0.34395053070970477,0.0443125,0.42917675544794187,1.7979235760094388,11.75,0.5966349244117737,5.562712765957446,3.0740425531914894,8.746153846153845,0
1692747394818610-3,2.5,2.5,2.5,2.0,2.5,2.5,2,"So my culture is, nowadays, is Buddhism. You know, I am Buddhism so the kind of activity I usually do like we need to go to pagoda when we have any festival, you know, like Khmer New Year or Chumban or something like that and...",9,1589.1204252520204,1643.3492355981593,563.9969467387773,475.00396537822985,3716.915906799545,-9.446642,24.23501,7132573.0,2033.6267789763308,1862.4916734991662,1334.6146,0.052208282,0.12752508348034275,0.4093961801759433,0.025375,0.4092741935483871,1.7715350382047212,26.0,0.5674499273300171,10.207692307692309,3.8676923076923053,8.058999999999997,0
1692747394818610-4,2.5,2.5,2.5,2.0,2.5,2.5,3,"So now I describe, I talk about homework. I usually have homework, I always have homework when I have class like Monday, Wednesday and Friday. And I think it's homework useful for us because it can make us review and self-learning at home. And do children in your country get a lot of homework? For my own opinion, you know, I think it depends on school. Some schools they give us a little bit and some schools they give us a lot, you know. So, depends on school.",7,1630.6835137587084,1674.4894022048102,576.9101407020172,409.7243120131325,3403.2553137390664,-11.368692,23.980005,6236207.5,2050.079709292231,1789.0405761072998,1374.302,0.04406104,0.13914375874533583,0.31665839014571445,0.0483125,0.412046908315565,1.7893447413724344,14.714285714285714,0.5744355916976929,5.500027739251042,3.6532038834951486,9.636737012987012,0
1692747394818610-5,2.5,2.5,2.5,2.0,2.5,2.5,4,"Well, first question is do I like to go into museum and art gallery? For my own opinion, I never go there before. Because in my country have a few museum but I never go there because it's not my vibe. I don't like museum or art gallery. And I will go there someday because I want to know in museum what we have, you know. And when I go to museum, I prefer with my friend because I can talk or share with them. And the last question is are there many museum or art gallery in your country? There are no art gallery in my country. And yeah, we have a few museum in Phnom Penh. So, yes.",12,1755.2214694301933,1666.9261505206805,747.9557642251634,338.4695187207489,4142.26250923435,-12.6350355,24.830853,6755399.5,2122.398995867964,1815.4784159821336,1636.6641,0.037698828,0.12253867730277902,0.30764839733642746,0.0561875,0.4029583146571044,1.8063001276853345,13.8,0.5931020379066467,4.499246376811595,1.8255072463768123,7.452750000000002,0
1692747394818624-1,2.5,3.5,3.0,2.5,3.0,3.0,0,I usually do my homework at home and just spend my holiday to... Sometimes I go to... with my family go to province to have... enjoy our holiday and just... Mostly when we have free time from work or from school we always make a plan to... for our holiday and we also go to the four lakes in the Kerala province to... enjoy our free time. Mostly we spend holiday with my family.,2,1433.4792339111268,1696.1319110584368,762.5723475902605,313.86735045108964,3697.7006379099303,-13.616744,19.860935,2743092.5,2053.806743565964,1882.9003944371957,1262.0009,0.06507455,0.107999092417259,0.6025471758026336,0.077125,0.5482007996446024,1.7329302194658671,27.333333333333332,0.5675824284553528,11.187073170731711,4.987804878048781,4.479189189189189,0
1692747394818624-2,2.5,3.5,3.0,2.5,3.0,3.0,1,"For now, I have a job for work. Yes, I work in a TOC at a private school and also I'm studying at a small university. And yes, I like it the most to do the completing in my working, like my duty, yes, complete my duty. I always check my book or stationery that I have control. And I also, when I have free time I work, I also try to study by myself, yes, and try to do it well.",5,1462.9682881346168,1668.7665124804525,753.4514298628387,329.02913276146575,3774.4329648232765,-15.351709,21.490868,3619765.2,2131.934659545016,1878.376291194373,1473.4989,0.057455838,0.12359911977762804,0.46485636653371026,0.06075,0.5239892183288409,1.7893447413724344,19.6,0.5934739708900452,6.502979591836738,0.449795918367343,8.424512195121952,0
1692747394818624-3,2.5,3.5,3.0,2.5,3.0,3.0,2,The national holiday in my country is Khmer New Year. I always celebrate our Khmer New Year when it's time. I really like it so much because I and my family came together to see together. We also make a celebration like eating something together and also playing something like activity fun or traditional activity together too.,8,1423.4234247523461,1540.7213008244405,770.4052334576604,313.4826453588562,3690.1827985779005,-11.822054,21.050327,3469264.0,2103.09075400856,1884.9251847708938,1487.5165,0.085803255,0.12023442921582235,0.7136329918012642,0.0446875,0.4961832061068702,1.7622790545754494,15.5,0.5750683546066284,9.677580645161296,8.086451612903222,12.798157894736839,0
1692747394818624-4,2.5,3.5,3.0,2.5,3.0,3.0,3,"Yes, the teacher that I never forget in my mind is... He is... He is a male and he is tall and has nice skin and... He is always friendly to other students. And yes, I like him so much because he... Always help me and also friendly to me too. Also to others. And while in class, when we have a problem or... Not sure about something that we are doing, we... Always ask him and he always help me or others too. The activity that I always do with him is... Do the homework. Or... Playing fun activity in class. Yes, of course.",5,1355.655758845583,1351.2894172679994,747.8492680864723,305.82394660707934,4251.150024288194,-12.16818,21.389925,3672060.2,2051.5268575910263,1826.9787317592668,1472.4625,0.095103964,0.12948554307818755,0.7344755402703894,0.04625,0.4230989136649514,1.7893447413724344,9.615384615384615,0.6225638389587402,2.6976000000000013,0.8783999999999992,3.7686912442396334,0
1692747394818624-5,2.5,3.5,3.0,2.5,3.0,3.0,4,"Of course, I like reading. I always read when I have free time from my work. I try to read books a lot because it's really important to me to read a book. And yes, I always get books from the library because I can change a lot of books that I want just by paying for the member of the library. And yes, I try to read as many books as I can. Just people in my country like reading books. A lot of, mostly of them like reading books. And they are always go to library to borrow book or reading book in the library too.",3,1337.4068829924333,1408.9351678951657,711.6334231674862,299.09319986070625,3337.294189771711,-12.526292,21.15708,3579683.5,1971.500279248688,1818.9597018484637,1412.8524,0.08555724,0.11427569923797157,0.7486914351696674,0.05325,0.4658283214871515,1.7622790545754494,15.125,0.598163902759552,4.54676652892562,2.118347107438016,7.823333333333334,0
1692747862784414-1,4.0,3.5,3.5,3.0,4.0,4.0,0,"The area I live in is in a small village in a town of the city. And the village is not really that big, but it's really peaceful. And I do like where I'm living right now, because it's not quiet and also not too loud. And I am not the type of person who loves to live in big city or busy places, so I really like where I'm living. It's really peaceful and calm for me.",5,1892.4075529598274,2016.724640060744,653.5349218092481,487.42088779540825,3803.4198056541445,-10.21407,17.209574,1924485.2,2257.0534046938433,1846.6685524389288,1644.842,0.077726,0.17232347188401875,0.4510470814423118,0.0343125,0.3961038961038961,1.7527703054973112,18.2,0.6031315326690674,6.031076923076924,1.376703296703294,8.591538461538462,0
1692747862784414-2,4.0,3.5,3.5,3.0,4.0,4.0,1,"The most difficult thing about my studies, I would say it's exams. And I find it difficult because I have to review and memorize lessons to take the test and in order to get good grades. And I think to make it easier, we should like review your lessons every day after you get back from school. And so, like, it's a bit by a bit then on the test day, you won't take too much time in reviewing your lessons. And also, you won't be having a hard time trying to memorize everything because you've already done it a bit by a bit.",7,1687.4880763116082,1675.2598865472166,733.1504988870096,405.38251404345436,3627.13686558115,-9.14287,17.500748,1842489.4,2204.459529136355,1870.179603165858,1579.1056,0.09259173,0.1595483017226748,0.5803366863869488,0.032125,0.34894772572980315,1.7527703054973112,24.0,0.606978714466095,8.815000000000001,3.644666666666666,12.746442307692313,0
1692747862784414-3,4.0,3.5,3.5,3.0,4.0,4.0,2,"If I were to talk about the place I like to go, I would say my mom's hometown. It is in Kampong Chan province. And I go there like on some special occasions or just like if my family were thinking of going there, we just go there. It's like unplanned. There we have like all the relatives are gathered and we have fun. We play, we eat together. It's really fun.",6,1894.7168721479673,2013.5276447166816,540.6724688583793,605.3249153451424,3302.5915411769306,-7.1164136,20.89191,3947088.5,2190.6622739916957,1918.7469916625005,1498.4067,0.08268981,0.16234107950737264,0.509358488128119,0.0315625,0.451295799821269,1.7805525680911245,12.142857142857142,0.5978094339370728,3.861008403361346,1.8235294117647065,7.328273809523811,0
1692747862784414-4,4.0,3.5,3.5,3.0,4.0,4.0,3,"The universities I think are popular in my country are RUFA, ChemEd University, and I think they are popular because of the education quality. RUFA is for designing whether it's graphic or not graphic, and for ChemEd it's business, so if you want to study business, ChemEd I think is the best choice. No, I do not want to study in one of them because that's not what I want to do.",1,1975.0925641003046,2138.170304569776,607.7575731323285,515.6660736140459,3350.413125283467,-10.010208,20.496704,3610786.2,2254.1954315326357,1918.1957117602342,1563.2306,0.059355922,0.14981681034482758,0.39618999968499047,0.0383125,0.4227586206896552,1.8063001276853345,28.0,0.5870733261108398,12.187142857142856,4.772857142857141,15.428333333333335,0
1692747862784414-5,4.0,3.5,3.5,3.0,4.0,4.0,4,"Yes, I do enjoy learning English because it's the second... it's the world's second language and it helps me a lot. Understanding native speaker and also being able to speak to one is a really pleasant feeling and I need to study English because nowadays jobs require the employees to be able to talk more than one language and you can travel the world with English. I don't think English is not really that difficult for me. It's only difficult when it comes to new words and like when you don't understand it but it's really fun to learn English.",2,1864.255323426654,2019.9653831584499,709.8219857334988,403.67519888475823,3738.419469961173,-8.938894,18.684082,2367626.5,2338.1427580954246,1942.8107453553341,1631.1481,0.08383046,0.16310031257541024,0.5139809947774889,0.0574375,0.4435328185328185,1.7715350382047212,28.25,0.5968415141105652,11.195641592920357,6.516106194690266,11.523657142857147,0
1692747862784419-1,4.0,4.0,4.0,4.0,3.5,4.0,0,"I prefer a hotel room than AirBnB because from younger till now I have only visited a hotel room or stayed in a hotel room. The most important thing when choosing a place to stay is that looking for the best option, the best prices and also the cleanliness, the hygiene and the security of it. As I remember, my last vacation was in Kampot province which is located in Cambodia. The place was good for me and the price was a bit high but it is also acceptable since the place is actually a bit luxurious.",3,1699.678611234841,1674.8994677309668,653.6008283142957,399.83630316960375,3833.1259580057713,-9.547478,14.120709,875331.9,2449.287214489654,2059.4054591929466,1363.1561,0.052897926,0.16340593166383702,0.3237209682742508,0.0425625,0.3853989813242784,1.7715350382047212,26.0,0.531091570854187,10.775000000000002,6.129230769230766,15.167577319587629,0
1692747862784419-2,4.0,4.0,4.0,4.0,3.5,4.0,1,Achievement is important for me because it could be put up in my profile once I graduate or apply for work. I have this achievement where I placed number one in my debate on my previous school. I didn't expect to achieve this because it is my first time ever joining a debate competition. I was so shocked when I achieved this because I just didn't prepare for it or think that I would get it. This achievement affected my life because I realised that I actually have a potential and I also have a talent for this kind of things.,4,1805.109696173744,1784.632644316492,606.8537351270375,542.6356179114027,4026.6601569675977,-10.721865,15.377803,1241518.9,2491.487758369655,2093.5498907243577,1422.2455,0.041902166,0.16645987027519893,0.251725330499556,0.048125,0.40848806366047746,1.7527703054973112,21.6,0.6173753142356873,9.441407407407407,6.186296296296295,13.339207920792077,0
1692747862784419-3,4.0,4.0,4.0,4.0,3.5,4.0,2,"The place where I live does have a clean water but not a clean air and especially the road is very sketchy and not good at all. As for my opinion, I think people can do many things to keep their environment clean such as instead of using their own vehicle, they can cut it off and actually using the public transportation instead. Help with the trash, for the trash they can divide it into three kinds of trash, the wet plastics and also the dry one. I actually try to help the environment by helping sorting out the trash, getting it into any charity work that have connection with the environment and I also cut down using my own transportation and use the public transportation instead.",5,1832.0566204486474,1863.4083146069502,622.8566497176406,549.7921538720982,4134.495596618272,-10.674055,15.8791895,1442751.4,2501.5885171021278,2141.184010388394,1381.0007,0.047473464,0.15707062239371442,0.30224279650563973,0.062625,0.4076484947111473,1.7429931071630576,34.0,0.5712188482284546,14.068529411764704,7.670882352941174,19.997677165354332,0
1692747862784419-4,4.0,4.0,4.0,4.0,3.5,4.0,3,Homework is necessary for me for the reason that in school I actually did learn a lot and I also catch up a lot but once I get into my house without doing any practice or homework I would forget all of it in just one day. I think that the teacher should assign me more homework so that I could not forget what I learned today. I actually don't spend a lot on my homework because my teacher doesn't assign us a lot of homework.,5,1885.821869625381,1881.4218174950597,623.7796888664894,544.8110726116031,4236.594546049766,-14.733854,15.005822,1170418.8,2522.0978546622246,2092.7687004369477,1475.6387,0.04148706,0.15983292368913857,0.25956517299251286,0.032375,0.3880149812734082,1.722562629490293,30.333333333333332,0.5985813140869141,12.059780219780219,5.258021978021979,16.234263565891474,0
