assessment_id,pronunciation_avg,vocab_avg,fluency_avg,cohesion_avg,grammar_avg,cefr_avg,suffix,transcript,filler_word_count,formants_mean,formants_median,formants_std,formants_min,formants_max,mfccs_mean,mfccs_std,mfccs_var,spectral_centroid_mean,spectral_bandwidth_mean,pitch,intensity,speech_rate,intensity_to_speech_rate_ratio,pauses_duration,pauses_frequency,brunets_index,average_sentence_length,cohesion_score,flesch_kincaid_score,coleman_liau_index,automated_readability_index,repetitions
1692748253740912-3,4.5,4.5,4.5,4.5,4.0,4.5,2,"International media is very important to every country. Maybe first of all, let us talk about the advantages first. So, international media allows people to see what is happening outside their own country. Local media is good, but international media could just open people's eyes to the outside world, could expose them to what is happening in terms of political, in terms of social, in terms of technology use. Like, see what the world is like and this could help people to be open-minded to accept the new changes. But it also could have disadvantages because somehow we are exposed to something that is not very useful or something that is harmful to our society. Maybe somehow we adopt the wrong idea because maybe different countries have different situations. So, somehow what we see from the other country could not be applicable to what we could do in our own country. To me, I follow a lot of media from the other country, especially the country with democracy, for example, like South Korea, the United States, because my country is quite communist and I want to learn about democracy and freedom from the other countries.",14,1423.8280929453335,1025.382890222311,1100.9845052498279,0.0,6143.708314126688,-21.263855,28.28938,11467582.0,1891.8626368263315,1480.9715314127995,1630.6621,0.07423403,0.1219457044196294,0.6087465851634783,0.065,0.3133473937933112,1.8224863886260672,24.333333333333332,0.5977093577384949,11.896347031963469,8.195068493150682,16.76964102564102,0
1692748253740912-4,4.5,4.5,4.5,4.5,4.0,4.5,3,"Lately, the role of the teachers have changed a lot as a result of the technology. First of all, let us talk about how technology has helped the students. So in the past, most students relied a lot on the teacher, like in case that they have any questions, they would ask the teacher. But nowadays, with the advance of technology, for example, we have the internet where the students can get access to and do their own research. So somehow it could help lighten the burden of the teacher, like the students do not have to rely a lot on the teacher. And the teachers will also feel less pressure, for example, in terms of marking and doing assessment or giving assessment to students. In the past, they would have to do it manually, like marking the students' paper and stuff, but now maybe they can just assign a link of the exercise and maybe they can post it in a digital platform and let students complete it by themselves. And it just automatically marks by itself, so this could help the teacher to reduce their paperwork. But I also believe that there could be also the drawback of the technology, because we have robots and we believe that one day the robot will replace the teacher. So somehow the teacher could be in a dangerous position of losing their job in the future. But again, whether there is a robot or not, I think we still need teachers because they could understand the feelings and what the student needs, rather than a robot who simply does not have emotions to understand the people's needs.",12,1274.9954103819673,1020.0096724635905,893.5744110243039,0.0,5964.2222014651725,-22.908634,28.77537,12903926.0,1742.9660364760498,1458.852329819805,1619.5035,0.06627666,0.1031020490599295,0.6428258473617093,0.086625,0.32573443008225617,1.7979235760094388,28.0,0.5863651037216187,11.459220779220782,6.815584415584414,16.96925889328063,0
1692748253740912-5,4.5,4.5,4.5,4.5,4.0,4.5,4,"Yes, I do believe that government have the right to actually force people to do things for safety because the government care about our safety. So that's why they could implement any measures to force us to do that. Maybe let us talk about safety on the road. So in Cambodia, people are forced to strictly abide by the rule. For example, they have to wear helmet all of the time regardless whether they are using motorbikes or bikes. They have to wear helmet in case that they do not wear it, they will receive punishment, for example, maybe fine of 10 or 20 dollars if they are found to not wear the helmet. So actually the rule is good. It's kind of, the people kind of feel forceful, but again, this is just for our own safety. So regardless of that, I think they have the right to do so.",7,1440.1805498075767,1062.2413027577363,1038.7555154615295,0.0,6101.663191260143,-22.993948,31.53468,18459366.0,1741.4931411659638,1425.5714970617587,1646.1542,0.07591202,0.09969413683252427,0.7614492036582386,0.05375,0.3339805825242718,1.8224863886260672,19.11111111111111,0.5942254662513733,7.1621705426356606,4.564418604651159,11.631802796173659,0
1692751298358255-1,3.5,4.0,4.0,4.0,4.0,4.0,0,"I believe the people who spend their entire lives in one place are the middle class people who cannot afford to go to places for a better life. The people who move a number of times in search for a better life are the people who could afford such things, who could go from country to country to live a better life. They have enough money so they could afford going from one place to another in search of a better and a luxurious life. But people who could not afford such things, they spend their entire lives in one place.",2,1219.7601330451785,938.6957955228432,653.5556194006192,361.90999692059677,2900.77106747016,-15.847602,14.694913,967235.56,1624.4095157187273,1579.0819273533793,1431.7239,0.09064214,0.10791091622081712,0.8399719184120815,0.0276875,0.34474708171206225,1.7329302194658671,27.0,0.6315146684646606,9.362222222222226,6.133703703703702,15.58440594059406,0
1692751298358255-2,3.5,4.0,4.0,4.0,4.0,4.0,1,"Long term planning is important because that helps to work things smoothly and it helps us in working without making any mistakes whereas if things are left to chance that often lead to mistakes and we often do such mistakes when we leave things to the last moment. The disadvantages of long term planning aren't such because long term planning often helps us to do things smoothly in correct order and they help us in doing our work accurately and beautifully, consistently without any mistakes.",0,1530.7085219593523,1346.9367136457392,762.6038918786223,441.77135740859575,3719.127769760462,-20.09453,17.828274,2019304.5,1963.4927072581945,1710.4649684606682,1710.8593,0.05392708,0.10860696481222842,0.4965342594404676,0.039,0.38733705772811916,1.7329302194658671,44.5,0.5617891550064087,19.133539325842694,10.754606741573028,27.304235294117646,0
1692751298358255-3,3.5,4.0,4.0,4.0,4.0,4.0,2,Social media platforms gives us the right to freedom of speech. The reasons for the regulation and the control of social media by the government can be like apps such as TikTok which was banned by the Indian government because it was an app which was made by another country which was China and the social media which regulates our country is by the Indian government.,5,1557.2160035324816,1277.0232508961196,810.1312373153208,396.31959268006864,3341.5139251969777,-19.454483,18.576406,2414289.8,1981.7559046676024,1755.4045337198809,1753.6189,0.0543893,0.10023538760434973,0.5426157666209173,0.027375,0.38488576449912126,1.7329302194658671,34.0,0.5654329061508179,15.196470588235297,9.530000000000001,21.331818181818186,0
1692751298358255-4,3.5,4.0,4.0,4.0,4.0,4.0,3,Many universities have increased their offering of online courses which has many advantages and disadvantages. The types of courses more or less suited to online learning are such as digital marketing or any such courses which are done through online. There are many platforms which offers online courses such as the Google Digital Garage which offers various courses which the students can take up online which is of course free of cost which helps students to enhance their knowledge and which helps them to broaden their skills. So it is really helpful and there are certain disadvantages to online courses also which are it may be straining to eyes which leads to cause problems in our eyes and it affects and it gives us stress that may be some disadvantages.,3,1361.2157591212613,1156.2504163063204,641.4096569665929,411.32457380718495,3790.0100194056845,-16.053108,16.19046,1416444.5,1912.8341507077948,1669.6309451727898,1404.3634,0.081112936,0.13959248636513882,0.581069499162983,0.049375,0.3481710004407228,1.7429931071630576,33.5,0.5254751443862915,14.998880597014928,11.180597014925372,22.500307692307693,0
1692751298358255-5,3.5,4.0,4.0,4.0,4.0,4.0,4,Some people are intrigued by antiques and ancient monuments because these ancient monuments tell us the history of a particular country and they help us to know a lot about the past lives of our country. And we need to put special efforts into protecting these ancient things because we gain a lot of knowledge of our past ancestors and of our past knowledge of our country which helps us in developing our country which was done in the past so that we cannot repeat the same mistakes again. So it helps us in a lot of ways.,5,1396.8084679737099,1176.2365422756247,642.9962827353093,460.2196020408389,3188.132403474981,-18.04306,16.13189,1427546.6,1908.2827669485482,1647.5939325868046,1547.7706,0.06885064,0.1315805589142762,0.523258428527382,0.0321875,0.34356237491661107,1.722562629490293,34.0,0.5705563426017761,14.097450980392157,7.944705882352938,20.08741496598639,0
1692751298358267-1,3.5,3.5,3.5,3.0,4.0,3.5,0,"I live, I used to live in Durgapur, but now that I'm in college, I live in Kolkata, near Deshpure Park. I can't say I hate the place where I live, but I don't like it either. It is, Kolkata, as you know, is filled with concrete and not, and there are not many trees there. So, it's nice, but...",3,1704.120427457377,1566.2539971391845,1093.7076237406404,0.0,6012.960590337876,-25.71529,30.66943,17298156.0,1857.9585635729288,1587.38182464378,1723.2428,0.043726075,0.0697269515687251,0.627104361468426,0.053,0.5630810092961488,1.7622790545754494,19.75,0.6080598831176758,5.854272151898737,0.1924050632911367,6.649000000000001,0
1692751298358267-2,3.5,3.5,3.5,3.0,4.0,3.5,1,,0,1515.4521500130645,1505.4295285715593,152.55692669556063,1058.6491628498075,1839.3137833142177,-3.513861,8.775624,156383.1,1824.7041807189287,1626.198838417271,1421.0928,0.105871744,0.16428920200892858,0.6444230245159583,0.000125,0.03571428571428571,0.0,0.0,0.0,0.0,0.0,0.0,0
1692751298358267-3,3.5,3.5,3.5,3.0,4.0,3.5,2,"summer in India is different in different states Kolkata where I live summer can be the worst humidity is at its peak in the months of March April May and then starts the rainy season so that's when everything gets better but during those months of summer people usually don't go out of their houses but those who have jobs they have to so for vacation they go away to hilly areas stations like Shilliguri or Jammu and Kashmir, Himachal Pradesh etc",8,1680.4986104475922,1493.995320111254,826.4999014669995,439.0356685457899,3930.0675780900747,-18.6971,27.637295,11974828.0,2234.7419268257377,1794.9851431969137,1813.492,0.07210479,0.12384104672862997,0.5822365945812439,0.041125,0.38524590163934425,1.7893447413724344,85.0,0.5062050819396973,34.774117647058816,9.239529411764703,1.0,0
1692751298358267-4,3.5,3.5,3.5,3.0,4.0,3.5,3,you,0,1497.1115336120738,1497.1704683355629,72.42531870147191,1328.6760270069226,1672.6992104193882,-5.888876,3.8927245,8048.941,1571.585252353294,1758.733408271948,1026.2817,0.03613073,0.0993508731617647,0.3636679670031135,6.25e-05,0.014705882352941176,1.1987400269386401,1.0,0.0,-3.3999999999999986,-27.759999999999998,1.0,0
1692751298358267-5,3.5,3.5,3.5,3.0,4.0,3.5,4,This is a test. This is a test.,0,1697.2400718560011,1518.3346024571235,766.9703331057074,1140.536503807077,5295.131344968298,-7.5475435,4.3728843,17235.09,1831.2686515595021,1926.277301302951,1023.94446,0.028533323,0.14768834952209534,0.19319955046523216,0.0025625,0.0407149950347567,1.4369776521848516,5.0,0.7094781398773193,-1.8399999999999999,-7.6080000000000005,-1.1787500000000009,0
1692751298358421-1,4.0,4.0,4.0,3.5,3.5,4.0,0,I do not like to play video games because I don't like playing digital games. I like playing something which is related outdoors like badminton or table tennis or any other game which requires someone to step out of their homes and staying inside and playing video games is not my thing.,6,1577.9570065443668,1501.4544853456114,526.9468114803909,658.2978646797635,3029.746723566369,-13.081798,17.669868,2244426.8,1994.822979392119,1716.0040004447505,1552.5485,0.07089441,0.13564340227601157,0.5226528641039488,0.01775,0.3283236994219653,1.722562629490293,27.5,0.5455281138420105,11.654999999999998,8.354181818181818,17.565576923076925,0
1692751298358421-2,4.0,4.0,4.0,3.5,3.5,4.0,1,"I do not like jobs which require someone to stay at their home. For example, work from home jobs, I do not like it because it's not difficult but it's boring. Because I am not able to connect with more people. I am just confined in my home and I cannot have exposure. But some people do like this job because work from home job. Some people do like because it is more convenient. It can save time and everybody has their own needs and everybody has their own way of... Like everybody is busy in some way or the other. So work from home may be convenient for some other people. But for me, I do not like it because I want some exposure. And I want to meet my colleagues and to know about the world more. And to stay in my home and do my job, I cannot do it.",13,1697.9348704441634,1566.9820077589202,642.3551811198355,628.4979704606535,3253.3581797209763,-19.413647,19.257324,3251425.0,2155.944770684535,1737.5976461705418,1740.3053,0.050756086,0.12801558672130192,0.396483638937914,0.0400625,0.29911339244050394,1.7979235760094388,15.727272727272727,0.6483424305915833,5.071960063058331,2.8469364161849704,7.307226890756304,0
1692751298358421-3,4.0,4.0,4.0,3.5,3.5,4.0,2,"I do not have a car because in my city Kolkata transportation is very much easy there are many public transports and metro stations and buses so it is very convenient to travel anywhere in the city and cars which are popular in my city or in my country we can say is is Suzuki, Honda city something like that these cars are famous in my country but I do not like like I the things that I do not like about cars because the automobile vehicles are we have become so many that it it is also become a reason for noise pollution and as well as air pollution and in a country like India where transportation is becoming better and better one should one should avoid using so many you using so many auto vehicles and use some public transport as well such as metro or bus or any kind of public transport which is convenient for them the people should use that because we should be eco-friendly also and lots of cars or any vehicle can result in the consequences of air pollution and noise pollution",14,1710.9264525829547,1583.2417016900138,587.8772082112913,719.4793232236201,3477.4864114532133,-17.746115,19.929813,3623277.0,2211.2820407471586,1753.5679941280532,1705.0436,0.06188033,0.14433343438501245,0.42873178865401673,0.05425,0.30900676397294413,1.7622790545754494,190.0,0.5604057312011719,75.77526315789474,8.9258947368421,1.0,3
1692751298358421-4,4.0,4.0,4.0,3.5,3.5,4.0,3,"My favorite subject at school was English literature. I liked it because I like reading and you know reading poetry to understand about the about nature and to understand the words and the thoughts of the poets is really mesmerized me and my Literature is something that I am also pursuing at my higher studies It's not very difficult, but it's very very interesting and people should study that I would recommend someone to study that because it It also teaches us about many It teaches us about English literature is a person who studies literature can know about feelings, emotions and culture as well.",8,2008.0455426076433,2012.7878731408018,683.7974922923622,665.4705289598314,3612.2834744561487,-20.32127,22.449121,5700719.0,2370.4788927664094,1872.032029675962,1826.9469,0.045602746,0.1256957150175644,0.3628027121010248,0.06075,0.45526932084309135,1.7715350382047212,55.5,0.5437743067741394,24.871216216216215,10.206126126126119,31.958571428571425,2
1692751298358421-5,4.0,4.0,4.0,3.5,3.5,4.0,4,"My favorite holiday is Christmas and in my country, in India, Christmas is not celebrated like Diwali, Holi or Eid. But it is quite celebrated well in our country. And people like to go out and meet with their friends to have dinner and to go to churches and pray. And all the city lights are on and the Christmas tree is up. Everything is decorated during the Christmas time. And why I like this holiday? Because it somewhat gives me a sense of unity and some peace. Because the weather is also very good at that time. The winter season is very calm and very peaceful. So that's the reason I like this holiday very much. And in my country, it is not celebrated as big as Diwali or any other holiday. But it is celebrated quite well and people really really enjoy the time during winter. And all the people reunite, they give gifts to other people and to...",10,1833.8311629449072,1711.4120762149873,635.736363387688,630.6874212564759,3846.2355564327913,-19.203102,21.256203,4938489.0,2277.3065543826388,1808.7495066828874,1803.3909,0.060298275,0.138801415286847,0.43442118423576825,0.062,0.3701492537313433,1.830314246685307,13.846153846153847,0.5784040093421936,6.264444444444447,4.830888888888886,9.007908902691511,1
1692751298358446-1,4.0,4.5,4.0,3.5,3.5,4.0,0,"The basic problem that we would face while moving to a new country is the day-to-day expenses. And I think to solve that issue, to deal with that, I would look for a job which would pay my day-to-day working expenses.",1,1352.651078612754,1177.57196436121,724.2446770165943,0.0,3860.29986991204,-16.666481,41.859604,56071380.0,1537.63769988087,1264.1516711615595,1687.3868,0.15609896,0.095791015625,1.6295783149562901,0.013875,0.3415384615384615,1.7622790545754494,22.5,0.5777286291122437,8.393888888888892,6.012444444444441,13.748536585365855,0
1692751298358446-2,4.0,4.5,4.0,3.5,3.5,4.0,1,"This has never happened to me before, but if it would, I would want to be straightforward with the person who has assigned that task to me and say it on the face that I don't want to do such kind of task.",1,1228.3093965860776,1109.1272748743374,739.958358968833,0.0,4408.657592221077,-17.651487,42.61604,59349276.0,1477.7040036253525,1203.0677988397895,1690.1707,0.14717607,0.10117833754595588,1.4546203819034766,0.0110625,0.32536764705882354,1.7329302194658671,47.0,0.6499662399291992,16.79957446808511,3.837446808510638,22.41511627906977,0
1692751298358446-3,4.0,4.5,4.0,3.5,3.5,4.0,2,think artists nowadays get their hands around the money which they deserve not all of it but a limited amount of it so I don't think that every mode of music every music platform needs a way where artists can be fed and I don't think government needs to be involved in this this is something a more of a social issue more of a artist and fan issue and it should be solved in that criteria,4,1520.1517781018374,1423.9451595252563,769.4389910426097,0.0,5237.425546670434,-15.998278,39.79531,46634708.0,1674.2613131885873,1327.1257985783616,1745.0024,0.13987312,0.10648706779013961,1.313522102835408,0.02375,0.33158813263525305,1.7008268430839244,79.0,0.5798620581626892,31.20227848101266,7.047594936708862,1.0,1
1692751298358446-4,4.0,4.5,4.0,3.5,3.5,4.0,3,For some the classes are not that important and which is why I think it should be an option to attend classes or not because if people should be should not be forced on doing something which they don't like or appreciate so when we have that option it also gives the universities an opportunity to provide quality learning since they have those students who are genuinely interested and not who are just forcibly seated into the classrooms.,5,1446.271638604156,1353.7622735150699,719.9053131416576,0.0,4710.29286266615,-15.340072,38.730556,40873132.0,1717.4586486280834,1318.1261822296835,1839.5391,0.14964218,0.11738137637867647,1.27483753380064,0.0206875,0.28633217993079585,1.7429931071630576,80.0,0.6035138964653015,33.16250000000001,10.510499999999993,44.13923076923077,0
1692751298358446-5,4.0,4.5,4.0,3.5,3.5,4.0,4,"It depends upon the, upon how extreme the government goes. There are certain actions which need to be taken for safety purposes and which is fine but there is always a line to invading someone's privacy. I think like certain things like literally getting into people's phone, getting hand into their data, these things are kind of an invasion and violation of privacy. So that's where the line comes.",4,1465.702607556968,1313.9578276439543,838.6125339523112,0.0,6686.679630581445,-16.583555,41.385128,54580548.0,1679.7678998987933,1299.9711357502536,1791.6177,0.1365828,0.1108508991745283,1.2321307966242732,0.0198125,0.2990566037735849,1.7527703054973112,19.75,0.5747089982032776,9.140348101265822,7.412151898734173,14.499347826086954,0
1692751298358501-1,3.5,3.5,4.0,3.5,3.5,3.5,0,"I would like to talk about the differences between living in a household and living in an apartment. So according to me, living in a house is not more expensive than living in apartments. In my country, houses are more common than apartments. I live in a house. I would prefer to live in both. A house will give you a feeling of your own ownership. But if you live in an apartment, it will be definitely a bide one and of course you will get a lot of benefits with your apartment like there can be more safety security guards and also you have neighbors to interact with. But living in your own house, you will be alone without any neighbors, without any kind of community. Also in apartments, there are a lot of facilities which are not possible in house.",5,1397.0690389750816,961.1375433717835,1078.9897383205941,0.0,5917.145975111362,-24.70012,31.48697,18471642.0,1645.6831883490247,1340.7141537824382,1894.3284,0.058562066,0.08412469502699335,0.6961340708245134,0.0580625,0.385797342192691,1.7527703054973112,17.444444444444443,0.5818473100662231,7.673205944798301,5.536305732484074,11.534663536776215,0
1692751298358501-2,3.5,3.5,4.0,3.5,3.5,3.5,1,"I would like to talk about work and old age. People should stop working at the age of 55. It is a bad idea for adult people to work because they face a lot of health issues and when they are young they can concentrate more towards work and they can put a lot of efforts but when they are in the elder phase of their life when they are getting old their capability decreases. No, I don't think that I will keep working when I'm old because I will like to enjoy my time after getting old being with my family because after working from since your adulthood till you reach your old age it is better that you spend now quality time with your friends and family because you have been working since a long time so now it's the time when you can dedicate yourself towards your hobbies towards your interest and also you can live the way you want to live you can do your favorite things you can go on a world tour explore the world and give time to your friends and family also do household things",5,1487.3775203277833,1020.0530876133139,1099.8862366594317,0.0,6860.0440934655535,-25.006815,31.922392,19229544.0,1668.6444122364003,1374.5989208632554,1947.8054,0.05871782,0.07551731754288438,0.7775411349859707,0.0779375,0.39612452350698857,1.7805525680911245,50.0,0.5918893814086914,18.896000000000004,7.0398,34.87236614853195,0
1692751298358501-3,3.5,3.5,4.0,3.5,3.5,3.5,2,"I would like to talk about fines. You can get fines for not following rules. It is fair to get fine for something when you have not followed a rule, when you have broken something, when you have broken a rule. You should get a fine because it is an effective solution for you to resolve your problems and also not to do the same mistake again. Like if you break a traffic rule, you will have to pay a fine to the traffic police. It will help you to not do the same mistake again.",7,1630.8831528933335,1192.8908820005404,1182.5601703225202,0.0,5290.6481122891455,-25.464735,30.953556,17065638.0,1786.3291350910047,1390.3799831755168,2024.4274,0.05828229,0.0818380977553676,0.7121657425156106,0.0400625,0.41704619388418995,1.7329302194658671,17.5,0.6212989687919617,6.294047619047618,4.01257142857143,10.0709375,0
1692751298358501-4,3.5,3.5,4.0,3.5,3.5,3.5,3,"The main difference between public and private education in my country is Here the public education quality is lower than the private educational quality Though private education is expensive, but they dedicate a lot towards your child's future And the education there is far more better than that of a public institute or public educational college or school So according to me, I think that private education is better I will definitely send my children to private education system Yes, in my country private education is very popular",1,1570.4368505922027,1183.3544841969665,1117.6309661014045,0.0,5961.494631464459,-25.880493,30.750456,16529941.0,1645.6887831936208,1326.4557944135302,1947.0273,0.050662436,0.07744950075200535,0.6541350828515068,0.04925,0.4213903743315508,1.7805525680911245,92.0,0.5576536655426025,41.19652173913043,12.575217391304342,1.0,0
