assessment_id,pronunciation_avg,vocab_avg,fluency_avg,cohesion_avg,grammar_avg,cefr_avg,suffix,transcript,filler_word_count,formants_mean,formants_median,formants_std,formants_min,formants_max,mfccs_mean,mfccs_std,mfccs_var,spectral_centroid_mean,spectral_bandwidth_mean,pitch,intensity,speech_rate,intensity_to_speech_rate_ratio,pauses_duration,pauses_frequency,brunets_index,average_sentence_length,cohesion_score,flesch_kincaid_score,coleman_liau_index,automated_readability_index,repetitions
1647885061811312-1,3.33,4.33,3.67,4.0,3.67,4.0,0,"I would be happy to go to the past and meet my ancestors in order to ask them about things that I have in the current time. I think there are several benefits of going to the past rather than going to the future. One of them is the ability to see things that we miss, our parents, our grandfathers, and people that we just saw in the family albums. And to see them, it's a great pleasure that we can, in this occasion, ask them questions that we always want to ask them. Yeah, that's the reasons.",2,1575.0082588601992,1280.3717025309886,1077.0197467420703,0.0,5767.395810418814,-19.980368,31.9179,17586446.0,1930.4468069737459,1554.1185492141935,1593.8506,0.039929543,0.10577355285768839,0.3775002504098372,0.0475,0.3869653767820774,1.7715350382047212,22.4,0.6251153349876404,7.79064285714286,3.8260714285714243,12.208367346938779,0
1647885061811312-2,3.33,4.33,3.67,4.0,3.67,4.0,1,"I prefer to be most remembered for my great wisdom, not my great kindness. There are several reasons for this. First, I would like to contribute to the knowledge and to enable to help people to overcome some problems and I need wisdom, not kindness, in order to accomplish that. Second, I think people will appreciate more people that contributed to the humanity in general, to all human beings, rather than just being kind. Because being kind is restricted to one period of life and contributing to knowledge is something that can have effects for several generations.",6,1485.3283758404882,1233.3642488027472,1026.0216231208653,0.0,5537.60589666358,-20.769653,36.38053,30827758.0,1863.084691451444,1513.257088938995,1588.4949,0.04197018,0.1013758671906138,0.4140056173921699,0.059125,0.3770426464726983,1.7622790545754494,21.8,0.5807843208312988,10.124844036697251,8.35816513761468,15.898762886597936,0
1647885061811312-3,3.33,4.33,3.67,4.0,3.67,4.0,2,"I prefer to be the first person to explore a planet rather than being the inventor of a drug that cures the disease. I can think about two main reasons for doing that. The first reason is that I read a lot of science fiction novels in my childhood. I would be happy to be the first man to step on one planet. Furthermore, I think there are a lot of things that we can discover on a new planet. It's a great adventure that I would not miss in any case. Another thing is that I'm not in physics so I will not invent a drug that can cure a deadly disease. I leave it to other people that are more proficient than me in this aspect.",4,1577.452084636966,1300.7760958566141,1015.4320209746876,0.0,5983.743043867562,-18.382305,30.395288,14430838.0,1951.3182447791885,1565.8471096207797,1607.9229,0.0504563,0.11534407509971971,0.437441631347117,0.0505625,0.3488572660629582,1.7622790545754494,17.375,0.5695907473564148,5.872580935251801,3.6897841726618665,9.678437500000001,0
1647885061811312-4,3.33,4.33,3.67,4.0,3.67,4.0,3,"I think there should be restrictions for publishing information in social media. The first reason of that is we can control fake news that can damage not just communities and individuals, but also companies and families and a lot larger groups of people. And we should find a solution for this and provide people just the right information that is trusted and they will get benefit of reading this information. I think it's a matter, we should not provide any information that could offend people because people are the users of social media, a platform, and we should provide them the best service that we can offer.",5,1694.9512719298298,1442.8669426239333,1013.8530153059774,0.0,7535.163800823522,-20.942108,32.268475,19053800.0,1966.1727546421757,1599.8796328140486,1638.024,0.036215387,0.10717502600039619,0.3379088266759257,0.057375,0.36370839936608557,1.7527703054973112,29.0,0.6037315726280212,12.707931034482758,9.081724137931033,19.104532710280374,0
1647885061811312-5,3.33,4.33,3.67,4.0,3.67,4.0,4,"Yeah, I prefer to be remembered for my great wisdom and there are several reasons for this. First, people will remember smart people that have changed the world, people that contributed to the knowledge in general, and if you are kind with people, it's good, it's a positive feature to have, but it will affect just a few people. And when you have great wisdom, you can have a larger effect. It might affect families and communities and maybe countries, and I prefer to have a larger effect in the world.",1,1694.526294823732,1396.98444542681,1132.5845167726775,0.0,6526.601736399041,-21.5206,34.11654,22989976.0,1877.3806761609596,1518.8069682585856,1618.2324,0.041594017,0.09764252722598366,0.4259825967097758,0.0508125,0.41543178334184977,1.7622790545754494,26.5,0.6041086912155151,10.32990566037736,6.048301886792448,16.03115384615385,0
1655476060404937-1,4.33,4.0,4.33,4.0,4.0,4.0,0,"No, I don't want to be on a reality show. The main reason why is because I really want to, I really take care of my privacy. I don't want the people all around me, especially outside of my neighborhood or my city or at work, I don't want them to know about me anymore. And what I want to give or to show, I prefer to leave it like that and to make my friend on my way.",2,1231.807131980138,998.5449500205864,862.431407016138,0.0,5723.787145108157,-20.090313,33.876,23565418.0,1534.0754025343447,1340.46914062067,1541.721,0.07076272,0.08719189203577513,0.8115745860323427,0.02575,0.35093696763202725,1.7527703054973112,22.75,0.6487758755683899,7.675906593406598,1.637362637362635,10.38525316455696,0
1655476060404937-2,4.33,4.0,4.33,4.0,4.0,4.0,1,"My favorite social media platform that I prefer is Facebook. I prefer it because there is a lot of things that you can see from comedy shows that you can laugh and relax at the end of the day and also you can look for work. That's how I found this job. There's a lot of opportunities to see outside of your own eyes, to open your mind, to see other things that you might be curious about. That's why I prefer that platform. Also I can put and use this platform and also keep my privacy. I can choose whatever I want to show, I can choose whatever I want to see and that's why I prefer that.",4,1396.3447068348908,1109.972030446789,905.0794730550657,0.0,6032.933457774818,-20.941254,32.35336,19849124.0,1782.2658920448614,1451.9783338136544,1618.5126,0.06444763,0.11403374709880637,0.5651627532302151,0.040125,0.3405835543766578,1.7805525680911245,19.0,0.6091265082359314,6.725263157894737,3.5094736842105263,10.422100840336135,0
1655476060404937-3,4.33,4.0,4.33,4.0,4.0,4.0,2,"I prefer to work every day in a few hours because I like to get up in the morning, get in dress, come to the office, talk to people. I prefer to see how I can do more at work every day and only on Shabbat and on Friday to have a relaxing day that I can do whatever I want to.",1,1470.6418699208243,1270.674577227905,944.7081605018209,0.0,5104.301706864119,-21.816162,32.61167,21054722.0,1773.8956784255604,1466.5017841157248,1649.1538,0.062639214,0.10553784640330188,0.5935237095807725,0.0255,0.3849056603773585,1.7429931071630576,33.5,0.6222141981124878,12.092910447761195,2.0973134328358185,14.961129032258064,0
1655476060404937-4,4.33,4.0,4.33,4.0,4.0,4.0,3,"I prefer to invert or a drug because the most of the things that I believe in my life is saving people's life. And if I can help with that, it will be the most happiest thing I can ever give to the world and to myself that I achieved something and I can also do something in my life.",3,1376.7166324067532,1050.3062664619254,966.6142610621563,0.0,6542.974928960285,-19.505165,32.26807,20150524.0,1780.3576503489041,1490.3434199635126,1582.3302,0.06439946,0.1098467817779831,0.5862662285192967,0.0218125,0.368532206969377,1.722562629490293,32.0,0.6118909120559692,11.455625000000001,3.854999999999997,15.785499999999999,0
1655476060404937-5,4.33,4.0,4.33,4.0,4.0,4.0,4,"Wow, that's a very hard question Because I like the way I live now I'm not saying that I'm Perfect, but I prefer to live my life as it is simple and with no superpower and I Really likes my the way I'm living and I hope that it will be better without a superpower",2,1354.9719199246865,1061.6380644572805,912.163657352327,0.0,6095.76818909497,-19.944265,33.56482,24762668.0,1624.5733769543563,1432.863080012493,1542.4653,0.0711523,0.09833811622008325,0.7235475152210785,0.019,0.31633714880332986,1.7622790545754494,61.0,0.6159486770629883,23.095081967213115,3.860983606557376,1.0,0
1659856072110825-1,5.5,5.0,5.0,4.5,5.0,5.0,0,"Health and well-being is important at the workplace because health and well-being provide a safe environment and a productive environment for those who are at work with you. You wouldn't want your coworkers to not be involved in healthy habits because you want to be influenced by good people who are going to be around you. When I was beginning a job one time, somebody started smoking around me and that was something which was very hard for me. My employer brings in a dog to the office and I happen to be allergic. These are unhealthy habits for me and therefore I would rather that workplace habits be healthy and safe for all.",2,1352.2038855888409,1172.7129684209033,681.9634040596749,0.0,4582.768103484824,-18.405369,29.350693,14576940.0,1759.0267505733225,1494.171849990656,1294.4839,0.06675808,0.11393245377863546,0.5859443828591214,0.0146875,0.2340637450199203,1.7893447413724344,24.2,0.5476745367050171,10.524033057851238,8.197685950413224,16.08157894736842,0
1659856072110825-2,5.5,5.0,5.0,4.5,5.0,5.0,1,I went on vacation that one time to New Zealand. It was great. And I went scuba diving and skydiving. It was great.,0,1254.5645039807189,1179.569218685645,638.6441522788871,0.0,6666.821386706079,-13.895765,30.89834,17066292.0,1740.9457231615459,1419.7517680198766,1257.4297,0.09474969,0.1272860440340909,0.7443839567894507,0.00225,0.20454545454545456,1.7118692955940733,6.75,0.5567026138305664,1.9017592592592614,0.06814814814814874,4.995000000000001,0
1659856072110825-3,5.5,5.0,5.0,4.5,5.0,5.0,2,"Next weekend, I'm going to go and visit my siblings in Ranaana, and it's going to be great.",0,1233.4508082410234,1118.173031777367,715.4046633099591,0.0,5326.666767649092,-19.693333,36.536545,34784184.0,1562.5890220804426,1312.0501706123246,1360.3174,0.060827944,0.10930129716981132,0.5565162171243576,0.00325,0.3270440251572327,1.7008268430839244,23.0,0.6222049593925476,7.745217391304351,1.8313043478260838,11.381666666666668,0
1659856072110825-4,5.5,5.0,5.0,4.5,5.0,5.0,3,"How many oral questions do they get? There are five questions that are yes, indeed. Five questions. Five questions. Each calibrated against what the exam has been able to detect up until now that this person will be able to succeed with. What advice do I give a new worker in my job? The coffee machine needs to always be stocked. Otherwise, I'm going to be unhappy.",1,1495.3069737404053,1404.0817412765377,690.6594779998557,0.0,3707.5414104233114,-17.59248,28.864676,13571339.0,1889.6898315525636,1541.379698064961,1431.6382,0.054245804,0.13093425010195758,0.41429804243688295,0.011375,0.2969004893964111,1.814484591177755,9.75,0.5632975101470947,3.794551282051284,3.7794871794871803,8.486753731343285,0
1659856072110825-5,5.5,5.0,5.0,4.5,5.0,5.0,4,"Great kindness, kindness. It is more important to have other people love you and be cared for by you. Other people are what make us who we are and therefore, whatever.",0,1196.7678522910771,916.8106639674086,715.6060060035766,434.84569498916414,6098.557607167047,-18.46958,28.040115,12009345.0,1515.0543349900547,1337.8976799071945,1206.919,0.065061234,0.09967062282229965,0.6527623897137317,0.0048125,0.2682926829268293,1.722562629490293,12.0,0.6078852415084839,4.495555555555558,4.109999999999999,9.109892473118279,0
1661070908438977-1,3.0,3.0,3.33,2.67,2.67,3.0,0,The thing that's interesting about my area of work is that I can help youth to get the job that they dream and good for them.,0,1651.4332283633767,1857.3725358608515,607.0022681841673,456.3353934908578,3993.581403057277,-16.927769,25.677933,8997978.0,2208.785815591163,2053.86165633941,1006.8385,0.054943215,0.11541748046875,0.47603894036513417,0.023625,0.49736842105263157,1.722562629490293,28.0,0.6311269998550415,9.23714285714286,4.142857142857142,14.214230769230767,0
1661070908438977-2,3.0,3.0,3.33,2.67,2.67,3.0,1,My answer was I'd rather to be an average person in the present.,1,1448.8353664171682,1299.138778502931,616.5111660566704,516.3631260080379,3094.168509006614,-12.587182,27.075016,10834599.0,2050.160152012992,1876.3810934477428,1082.0052,0.09166091,0.11653645833333333,0.7865427752446862,0.0083125,0.40672782874617736,1.652594045592809,15.0,0.6061285138130188,6.780000000000001,2.610666666666667,8.25769230769231,0
1661070908438977-3,3.0,3.0,3.33,2.67,2.67,3.0,2,"I will choose to be happy for two years, because I believe when you're happy, you can do anything you want. You can be a better person to your family, to your friends, to everybody who is near you. So this will be my answer, for sure.",2,1461.8473494006748,1371.6817665338788,674.0653809443719,355.97444105133394,3461.051728067904,-12.376987,23.585142,6201967.0,2133.4419058984777,1998.499531195582,1095.3427,0.09128716,0.11965851736540842,0.7628972883798448,0.019375,0.38366336633663367,1.7329302194658671,18.666666666666668,0.6631990671157837,6.650714285714287,2.3542857142857123,9.853120567375885,0
1661070908438977-4,3.0,3.0,3.33,2.67,2.67,3.0,3,"I prefer, I think, 10 real life friends because I believe of physical connection and not social media connection. I believe that this is better connection and this is better for the human being to be eye connection and physical connection rather than social media connection.",3,1556.0385327540707,1510.0381747259225,662.819155543855,469.9273895704432,3365.8467988355337,-12.720068,24.94474,7924228.5,2111.7460089507726,1975.9853070348,1150.5424,0.082961105,0.11648487390610218,0.7122049587065903,0.028375,0.4295175023651845,1.722562629490293,25.0,0.5927563309669495,12.568000000000001,10.063999999999993,18.227608695652172,0
1661070908438977-5,3.0,3.0,3.33,2.67,2.67,3.0,4,"No, because these people are negative and there is no reason to bring them the option to be popular because I believe racist advice is bad.",1,1555.0690935364355,1854.3074780267048,630.1186662948763,391.0687134481527,3184.1539648121043,-15.306192,23.257011,6397713.0,2042.0450015515387,2030.8836582426293,882.04974,0.056385003,0.08683349609375,0.6493462265923732,0.0273125,0.54625,1.6775871580592954,28.0,0.6184601783752441,11.765714285714285,7.08285714285714,16.75038461538461,0
1662420268098487-1,3.0,4.0,3.0,3.0,3.0,3.0,0,"The person who is the most important person in my country is López Obrador, because he's the president of my country, Mexico, and he has made some solutions for every single necessity or problems in my country, and he has a lot of persons, interest persons, because the curriculum of these persons are political and professional qualities, has qualities, they have qualities for a lot of functions and solve problems, and it's the best thing that he has made, because some people in this team has the solution to all problems, and maybe he's a polemical person because he has a history in my country, but people know that the problems in Mexico are really, really, very anxious, has a lot of years, and there he has the opportunity to change my country and do a lot of politics to make the changes.",12,1361.0110608249977,1058.6306864834612,934.2084275553058,0.0,5790.482069931002,-21.601088,29.685001,12798881.0,1711.1703421989348,1496.5255485932764,1528.8113,0.047212373,0.09385031982857507,0.503060336411604,0.086875,0.35432067295437164,1.7893447413724344,163.0,0.5908097624778748,64.99226993865031,7.682699386503064,76.35377622377624,0
1662420268098487-2,3.0,4.0,3.0,3.0,3.0,3.0,1,"My best teacher was maybe, I don't know, my first teacher in primary. She has a lot of patience and creativity, and she has so many equipment or tools for learning, and she has freedom in her class. She has a lot of knowledge about science and different things, and maybe another of my teachers was Arnaldo Corva, the personality of a human personality class, and he has discipline and he has a lot of knowledge too, like my other teacher, and he was the Ruth, Ruth, yes? Because he has a lot of maybe discipline, or I don't know, he worries about our knowledge, he worries about our learning, and he has a different kind of practice, and sociodramatic practice, and the class was really, really fun and really, really tense in some cases, because he was with a whole group, and they had a lot of, I don't know, I don't know.",7,1333.940583668451,1010.6735636732616,944.2302136275872,0.0,5856.929660247317,-19.1508,33.243717,19584564.0,1751.4024465378254,1455.5496038080917,1629.9768,0.07074873,0.10712698090841029,0.6604193536867945,0.0911875,0.364112802595458,1.7979235760094388,46.25,0.5837227702140808,18.074527027027028,4.918702702702703,23.052142857142854,0
1662420268098487-3,3.0,4.0,3.0,3.0,3.0,3.0,2,Thank you. Bye bye. Bye bye. Bye bye. Bye bye. Bye bye. Bye bye. Bye bye. Bye bye. Bye bye. Bye bye. Bye bye. Bye bye. Bye bye. Bye bye. Bye bye. Bye bye. Bye bye. Bye bye. Bye bye. Bye bye. Bye bye. Bye bye. Bye bye. Bye bye. Bye bye. Bye bye. Bye bye. Bye bye.,0,1649.638597301815,1821.5217343624063,639.7017672268839,248.536962221646,2812.504119314326,-16.09829,11.106372,277213.53,1875.7501626990997,1859.8656132085555,1481.6567,0.05872693,0.06855305080307263,0.8566639768793164,0.00775,0.6927374301675978,1.526865046259939,3.0,0.6003328561782837,-2.619999999999999,-11.811494252873564,0.8462068965517275,28
1662420268098487-4,3.0,4.0,3.0,3.0,3.0,3.0,3,"Well, I think different work office is not usual in the future. Maybe we can define our births in different things because the manipulation of the genetic is very, very dangerous but it's a benefit for the people and maybe we can understand that I think maybe we need to make the human nature really, I'm really worried about that because we don't know the future has pollution, has contamination, has a lot of things but I don't know if only in the nature or maybe it's more in the mind of the people and I maybe I think in the future if we don't change now in the future maybe we don't have nothing, we don't have anything or the people disappear to the earth but I think we can change and we can go to other planets or we can go to other contexts or we can approve different political laws that care people and pollution, reduce the pollution and reduce the, I don't know, the mental health benefits will be more interesting.",1,1242.0620165056894,900.7987402998907,893.5371257142535,0.0,6623.973674050611,-20.031063,30.495716,14342354.0,1636.3171400527017,1474.3080912456403,1651.6469,0.062366314,0.08709431694619876,0.7160778845177151,0.0899375,0.3429456625357483,1.7527703054973112,97.5,0.6151554584503174,38.34987179487179,6.632410256410257,47.29645714285714,0
1662420268098487-5,3.0,4.0,3.0,3.0,3.0,3.0,4,"It's a difficult question because I think the world has a lot of hunger, or I don't know, maybe we have the necessity to take decisions, not political decisions, but human decisions that make the change. I don't know if we can or could or will finish the war, but I don't know.",1,1265.3734086354318,974.7265314583777,998.0383429709747,0.0,6766.068860900731,-20.156136,35.97469,26347518.0,1615.6042880548691,1388.709579902702,1638.3654,0.06956648,0.08991879772909968,0.7736589297489839,0.0409375,0.4212218649517685,1.7329302194658671,32.0,0.6484221816062927,12.193125000000002,3.9468749999999986,16.436415094339623,0
1667330281849843-1,5.5,5.0,4.5,5.0,5.0,5.0,0,"I would much rather be a first version me than a second version someone else. Why is this? Because I feel that throughout the years, the accomplishments I've made, the studies, my academic degrees, my studies in Israel and abroad, my skills, professional experiences, and maybe possibly personal challenges have definitely been something that has made me who I am today. I am proud of what I feel I have accomplished and honoured and thank God for who I am today.",3,1520.4719638266836,1164.5473105508727,1008.180451219786,0.0,5633.826299092305,-20.304039,32.535442,21915680.0,2137.42206307096,1673.5489954715079,1684.9072,0.07332057,0.12180070173346055,0.6019716353385945,0.0244375,0.33163698049194235,1.7715350382047212,23.25,0.5578739643096924,10.733413978494628,7.142365591397848,15.617592592592594,0
1667330281849843-2,5.5,5.0,4.5,5.0,5.0,5.0,1,This is an excellent question. I think I would rather have more time. Thank God I don't feel in a difficult situation in terms of financial needs. But I do feel a stress of time. Time constraint is definitely one of the challenges I am dealing with on a day-to-day basis. So more time would definitely be something I would be appreciative of and feel like it would in a very generous way transform my day-to-day life.,3,1281.9611230165503,1032.6587558185354,875.7030105100592,0.0,6643.986369719243,-17.795391,27.895748,11361542.0,1901.2929504587414,1538.9121071438033,1690.7642,0.091989666,0.12824094082446807,0.717319021773541,0.0201875,0.27489361702127657,1.7805525680911245,14.0,0.5741844773292542,6.727142857142859,5.955714285714283,10.494069264069267,0
1667330281849843-3,5.5,5.0,4.5,5.0,5.0,5.0,2,"This is an interesting question. The potential outcomes could definitely be going both ways. I would need to understand a little bit more in depth which type of students go to this school. There are children who would definitely benefit from technological advance and increased funding, whereas there are other children who would much further adapt and enjoy sports teams and sport funding.",0,1570.5432672854602,1320.1217303764315,903.2910546931828,0.0,5750.8184567150965,-20.370588,27.863222,10999342.0,2105.2344048393916,1620.2380135243193,1689.636,0.07163717,0.14133089014207378,0.5068755206638531,0.0171875,0.2741774675972084,1.7329302194658671,17.0,0.5489275455474854,9.260588235294119,10.821176470588231,15.602142857142859,0
1667330281849843-4,5.5,5.0,4.5,5.0,5.0,5.0,3,"I think that this is an excellent question. It would be quite difficult for social media companies to actually verify that everything is true. I think that truth today has become a bit of a slippery slope term. It would be quite challenging for a company to have to take it upon themselves to define whether or not a piece of information is true. So whether or not I agree with this statement, I think the implementation of it would be far more challenging.",3,1483.500360597624,1229.563207408531,856.9820858014648,0.0,4714.166857351014,-19.771624,25.230047,7340221.5,2106.776963882551,1589.7357952634657,1726.8647,0.07379663,0.15268212802962297,0.48333508877596243,0.01925,0.2764811490125673,1.7429931071630576,18.0,0.6050754189491272,8.605555555555554,6.990222222222222,12.594642857142858,0
1667330281849843-5,5.5,5.0,4.5,5.0,5.0,5.0,4,"As a student for an all-girls high school, I am very pleased that I studied in an all-girls high school. I think girls and women benefit far more from it being a separate sex, separate gender classrooms. I think that in lower school years, it might be beneficial to be in a more co-ed classrooms, so that might be a consideration to take into account. Boys might feel differently about this, but from my personal opinion, I believe that women and girls should study separately.",2,1549.804259157817,1260.0546092371746,898.53327422029,0.0,6326.472370605476,-21.517696,29.069382,13706932.0,2067.600605879277,1604.0254673548038,1653.3324,0.061771017,0.13794133595758354,0.4478064253846276,0.022125,0.3033419023136247,1.7527703054973112,23.75,0.5292826294898987,10.689342105263162,7.278315789473684,15.626411764705885,0
1668069779915833-1,4.5,4.5,4.0,4.0,4.0,4.0,0,"So, to learn another language, you should learn a lot of words, you can read a lot of books, you can use dictionary, there's a lot of movies and series that you can see scenes and to learn from that how to talk correctly and you just need to repeat it all the time and then it goes into your brain. You should do it that way because it's more fun and it's an easy way and there's a lot of things that you can learn with.",1,1028.4581728800626,673.6674902937523,929.6914571073756,0.0,5752.7986939887405,-18.772682,33.07082,18661538.0,1265.2539023044983,1218.6960742001072,1066.3643,0.07079528,0.06803644249883069,1.040549448521448,0.0249375,0.37324602432179604,1.7429931071630576,49.0,0.6243692636489868,17.12612244897959,3.635918367346939,23.057931034482756,0
1668069779915833-2,4.5,4.5,4.0,4.0,4.0,4.0,1,"So I would prefer to be most remembered for great kindness because I'm a more people person. I like to hear people's needs and I love to serve people and to make them feel better. And I feel and I believe that if you help to another person, it's much, much good that if you are more sophisticated or smarter. I believe in to do great things to another person. So yeah, I definitely go for great kindness.",7,1001.7939803463685,658.9692083350194,924.6116258741094,0.0,5626.027821108293,-21.054842,33.44681,18331646.0,1137.0063069703685,1114.90344179317,1086.3574,0.05509159,0.061850078501376464,0.8907278862714573,0.0384375,0.4232622161046111,1.7429931071630576,17.8,0.6268123388290405,6.5991910112359555,4.141123595505615,10.765384615384619,0
